{
  "code_table": "requirement_type",
  "description": "High-level types for normalized bylaw requirements.",
  "version": "0.1.0",
  "seeded_at": "2026-04-21",
  "entries": [
    {
      "code": "dimensional_standard",
      "label": "Dimensional standard",
      "description": "A measurable dimensional control such as lot area, frontage, yard, height, coverage, or density.",
      "status": "active"
    },
    {
      "code": "permitted_use_rule",
      "label": "Permitted use rule",
      "description": "A rule that permits a use, use class, accessory use, secondary use, or conditional use.",
      "status": "active"
    },
    {
      "code": "prohibited_use_rule",
      "label": "Prohibited use rule",
      "description": "A rule that prohibits a use, use class, activity, structure, or condition.",
      "status": "active"
    },
    {
      "code": "design_standard",
      "label": "Design standard",
      "description": "A built-form, site-design, facade, landscaping, architectural, or urban-design standard.",
      "status": "active"
    },
    {
      "code": "process_requirement",
      "label": "Process requirement",
      "description": "A procedural requirement for permits, applications, approvals, submissions, notices, or review.",
      "status": "active"
    },
    {
      "code": "agreement_requirement",
      "label": "Agreement requirement",
      "description": "A requirement for a development agreement, concept plan, site-specific exemption, or related legal agreement.",
      "status": "active"
    },
    {
      "code": "map_applicability_rule",
      "label": "Map applicability rule",
      "description": "A rule whose applicability depends on a mapped feature, schedule, boundary, or spatial designation.",
      "status": "active"
    },
    {
      "code": "parking_requirement",
      "label": "Parking requirement",
      "description": "A parking, loading, queuing, access, driveway, bicycle parking, or reserved parking requirement.",
      "status": "active"
    },
    {
      "code": "permitted_use",
      "label": "Permitted use",
      "description": "A requirement phrase or rule context for uses that are permitted.",
      "status": "active",
      "metadata": {
        "candidate_category": "permitted_use_rule",
        "source_jurisdiction": "Charlottetown",
        "source_document": "docs/charlottetown/charlottetown-zoning-bylaw.pdf"
      }
    },
    {
      "code": "parking_space",
      "label": "Parking space",
      "description": "A requirement phrase or rule context for required or regulated parking spaces.",
      "status": "active",
      "metadata": {
        "candidate_category": "parking_requirement",
        "source_jurisdiction": "Charlottetown",
        "source_document": "docs/charlottetown/charlottetown-zoning-bylaw.pdf"
      }
    },
    {
      "code": "accessible_parking_space",
      "label": "Accessible parking space",
      "description": "A requirement phrase or rule context for required or regulated accessible parking spaces.",
      "status": "active",
      "metadata": {
        "candidate_category": "parking_requirement",
        "source_jurisdiction": "Charlottetown",
        "source_document": "docs/charlottetown/charlottetown-zoning-bylaw.pdf"
      }
    },
    {
      "code": "zoning_map",
      "label": "Zoning map",
      "description": "A requirement phrase or rule context for applicability tied to a zoning map.",
      "status": "active",
      "metadata": {
        "candidate_category": "map_applicability_rule",
        "source_jurisdiction": "Charlottetown",
        "source_document": "docs/charlottetown/charlottetown-zoning-bylaw.pdf"
      }
    },
    {
      "code": "driveway",
      "label": "Driveway",
      "description": "A requirement phrase or rule context for driveways or access.",
      "status": "active",
      "metadata": {
        "candidate_category": "parking_requirement",
        "source_jurisdiction": "Charlottetown",
        "source_document": "docs/charlottetown/charlottetown-zoning-bylaw.pdf"
      }
    },
    {
      "code": "development_permit",
      "label": "Development permit",
      "description": "A requirement phrase or rule context for development permit processes.",
      "status": "active",
      "metadata": {
        "candidate_category": "process_requirement",
        "source_jurisdiction": "Charlottetown",
        "source_document": "docs/charlottetown/charlottetown-zoning-bylaw.pdf"
      }
    },
    {
      "code": "schedule",
      "label": "Schedule",
      "description": "A requirement phrase or rule context for applicability tied to a schedule.",
      "status": "active",
      "metadata": {
        "candidate_category": "map_applicability_rule",
        "source_jurisdiction": "Charlottetown",
        "source_document": "docs/charlottetown/charlottetown-zoning-bylaw.pdf"
      }
    },
    {
      "code": "application_shall",
      "label": "Application shall",
      "description": "A requirement phrase or rule context for procedural application requirements.",
      "status": "active",
      "metadata": {
        "candidate_category": "process_requirement",
        "source_jurisdiction": "Charlottetown",
        "source_document": "docs/charlottetown/charlottetown-zoning-bylaw.pdf"
      }
    },
    {
      "code": "minimum_lot_frontage",
      "label": "Minimum lot frontage",
      "description": "A requirement phrase or rule context for minimum lot frontage.",
      "status": "active",
      "metadata": {
        "candidate_category": "dimensional_standard",
        "source_jurisdiction": "Charlottetown",
        "source_document": "docs/charlottetown/charlottetown-zoning-bylaw.pdf"
      }
    },
    {
      "code": "maximum_building_height",
      "label": "Maximum building height",
      "description": "A requirement phrase or rule context for maximum building height.",
      "status": "active",
      "metadata": {
        "candidate_category": "dimensional_standard",
        "source_jurisdiction": "Charlottetown",
        "source_document": "docs/charlottetown/charlottetown-zoning-bylaw.pdf"
      }
    },
    {
      "code": "loading_space",
      "label": "Loading space",
      "description": "A requirement phrase or rule context for loading spaces.",
      "status": "active",
      "metadata": {
        "candidate_category": "parking_requirement",
        "source_jurisdiction": "Charlottetown",
        "source_document": "docs/charlottetown/charlottetown-zoning-bylaw.pdf"
      }
    },
    {
      "code": "shall_not_be_permitted",
      "label": "Shall not be permitted",
      "description": "A requirement phrase or rule context for prohibited uses or conditions.",
      "status": "active",
      "metadata": {
        "candidate_category": "prohibited_use_rule",
        "source_jurisdiction": "Charlottetown",
        "source_document": "docs/charlottetown/charlottetown-zoning-bylaw.pdf"
      }
    },
    {
      "code": "minimum_front_yard",
      "label": "Minimum front yard",
      "description": "A requirement phrase or rule context for minimum front yard requirements.",
      "status": "active",
      "metadata": {
        "candidate_category": "dimensional_standard",
        "source_jurisdiction": "Charlottetown",
        "source_document": "docs/charlottetown/charlottetown-zoning-bylaw.pdf"
      }
    },
    {
      "code": "minimum_lot_area",
      "label": "Minimum lot area",
      "description": "A requirement phrase or rule context for minimum lot area.",
      "status": "active",
      "metadata": {
        "candidate_category": "dimensional_standard",
        "source_jurisdiction": "Charlottetown",
        "source_document": "docs/charlottetown/charlottetown-zoning-bylaw.pdf"
      }
    },
    {
      "code": "minimum_side_yard",
      "label": "Minimum side yard",
      "description": "A requirement phrase or rule context for minimum side yard requirements.",
      "status": "active",
      "metadata": {
        "candidate_category": "dimensional_standard",
        "source_jurisdiction": "Charlottetown",
        "source_document": "docs/charlottetown/charlottetown-zoning-bylaw.pdf"
      }
    },
    {
      "code": "as_shown_on",
      "label": "As shown on",
      "description": "A requirement phrase or rule context for applicability shown on a plan, map, schedule, or other referenced source.",
      "status": "active",
      "metadata": {
        "candidate_category": "map_applicability_rule",
        "source_jurisdiction": "Charlottetown",
        "source_document": "docs/charlottetown/charlottetown-zoning-bylaw.pdf"
      }
    },
    {
      "code": "prohibited_use",
      "label": "Prohibited use",
      "description": "A requirement phrase or rule context for prohibited uses.",
      "status": "active",
      "metadata": {
        "candidate_category": "prohibited_use_rule",
        "source_jurisdiction": "Charlottetown",
        "source_document": "docs/charlottetown/charlottetown-zoning-bylaw.pdf"
      }
    },
    {
      "code": "minimum_rear_yard",
      "label": "Minimum rear yard",
      "description": "A requirement phrase or rule context for minimum rear yard requirements.",
      "status": "active",
      "metadata": {
        "candidate_category": "dimensional_standard",
        "source_jurisdiction": "Charlottetown",
        "source_document": "docs/charlottetown/charlottetown-zoning-bylaw.pdf"
      }
    },
    {
      "code": "approval_of_council",
      "label": "Approval of council",
      "description": "A requirement phrase or rule context for approval by council.",
      "status": "active",
      "metadata": {
        "candidate_category": "process_requirement",
        "source_jurisdiction": "Charlottetown",
        "source_document": "docs/charlottetown/charlottetown-zoning-bylaw.pdf"
      }
    },
    {
      "code": "signage_requirement",
      "label": "Signage requirement",